Nama,Nama_Display,Brand,Harga_Rupiah,Harga_Numeric,Sistem_Operasi,GPU,Tipe_GPU,CPU,Tipe_CPU,RAM,RAM_Numeric,Tipe_RAM,Penyimpanan,Penyimpanan_Numeric,Tipe_Penyimpanan,Berat,Berat_Numeric,Ukuran_Layar,Ukuran_Layar_Numeric,Tipe_Panel_Layar,Resolusi_Layar,Deskripsi,Product_URL,Image_URL,Label,Auto_Tag,Metadata
APPLE MACBOOK PRO 14 M5 10C GPU 16GB 512GB 10C CPU 14.0 SPACE BLACK -MDE04ID,APPLE MACBOOK PRO,Apple,"27,799,000.00",27799000,macOS,Apple Integrated Graphics,Apple,Apple M5 Chip,Apple,16 GB,16,LPDDR5X,512 GB,512,SSD,1.55 kg,1.55,"14,2 Inch",14.2,Mini LED,3K+ 3024 x 1964,Brand: Apple | Tipe: APPLE MACBOOK PRO | Color: Space Black | Operating System: macOS Dimensions: 31.26 x 22.12 x 1.55 cm | Weight: 1.55 kg | Processor: Apple M5 Chip CPU 10-Core GPU 10-Core | Graphics: Apple Integrated Graphics | RAM: 16 GB | Storage: 512 GB | Main Display Size: 14.2 Inch | Main Display Type: Mini LED | Display Resolution: 3K+ 3024 x 1964 Pixel Pixel Density: 254 ppi Keyboard: Backlit Magic Keyboard with Touch ID Trackpad: Force Touch Trackpad | Camera: 12 MP Center Stage Video Recording: 1080p HD | Audio: Six-speaker sound system with Spatial Audio and Dolby Atmos Microphone: Three studio-quality microphones Headphone Jack: 3.5 mm | Battery: 72.4 Wh Lithium-Polymer | Ports: SDXC Card Slot HDMI Thunderbolt 4 USB-C MagSafe 3 Headphone Jack Wireless: Wi-Fi 6E Bluetooth: 5.3,https://www.agres.id/products/ibox-apple-macbook-pro-14-m5-10c-gpu-16gb-512gb-10c-cpu-140-space-black-mde04id,PRODUK HABIS,"sultan, premium",cpu apple ekosistem apple performa sangat tinggi grafis apple multitasking lancar penyimpanan besar sedang layar sedang layar premium resolusi tinggi cocok kerja cocok multimedia,apple macbook pro m5 chip integrated graphics grafis ram 16gb ssd 512gb layar 14.2 inch cpu ekosistem performa sangat tinggi multitasking lancar penyimpanan besar sedang premium resolusi cocok kerja multimedia kantor buka banyak tab aplikasi anti lelet coding programming programmer software analis data nonton netflix kualitas bioskop warna akurat manjakan mata desainer tajam sultan
ASUS EXPERTBOOK BG1409CVA I5 1334 16GB 512GB 14.0FHD W11PRO 3Y -S65150X,ASUS EXPERTBOOK BG1409CVA I5,ASUS,"14,900,000.00",14900000,Windows 11,Intel Iris Xe Graphics,Intel,Intel Core i5-1334U,Intel,16 GB,16,DDR5,512 GB,512,SSD,1.39 kg,1.39,14 Inch,14.0,IPS,FHD 1920 x 1080,"Brand: ASUS | Tipe: EXPERTBOOK BG1409CVA | Color: Misty Grey | Operating System: Windows 11 Pro | Processor: Intel Core i5-1334U | Graphics: Intel Iris Xe Graphics | RAM: 16 GB DDR5 SO-DIMM | Storage: 512 GB M.2 2280 NVMe PCIe 4.0 SSD | Main Display Size: 14 Inch | Main Display Type: IPS Anti Glare | Display Resolution: 1920 x 1080 | Camera: 720p HD Camera with Privacy Shutter | Audio: Audio Stereo | Battery: 42 WHrs Charger: Type-C 65 W AC Adapter | Connectivity: Wi-Fi 6E, Bluetooth 5.3 | Ports: 2x USB Type-C 2x USB Type-A 1x HDMI 1x 3.5mm Audio Jack 1x RJ45 | Dimension: | Weight: 1.39 kg | Warranty: 3 Years Official ASUS Warranty + 1 Year ADP",https://www.agres.id/products/asus-expertbook-bg1409cva-i5-13334u-16gb-512gb-140fhd-w11pro-3y-tkdn-s65150x,PRODUK HABIS,"gaming ringan, esports, ringan, tipis, mudah dibawa, travel, menengah, multitasking, lancar, kinerja cepat, boot cepat, loading cepat",cpu intel performa menengah grafis ringan multitasking lancar penyimpanan besar ringan layar sedang layar bagus resolusi standar cocok kerja mudah dibawa cocok office,asus expertbook bg1409cva i5 intel core 1334u iris xe graphics grafis terintegrasi ram 16gb ssd 512gb layar 14.0 inch cpu performa menengah ringan multitasking lancar penyimpanan besar sedang bagus resolusi standar cocok kerja mudah dibawa office nugas skripsi kuliah sekolah pelajar mahasiswa browsing internet zoom meeting nonton film youtube word excel presentasi ppt kantor buka banyak tab aplikasi anti lelet coding programming programmer software analis data sering bepergian traveling mobilitas tinggi enteng tipis ke kampus nongkrong cafe gaming esports travel cepat
ASUS EXPERTBOOK BG1409CVA I7 1355 16GB 1TB 14.0 FHD W11 3Y TKDN -S67110W,ASUS EXPERTBOOK BG1409CVA I7,ASUS,"16,000,000.00",16000000,Windows 11,Intel Iris Xe Graphics,Intel,Intel Core i7-1355U,Intel,16 GB,16,DDR5,1 TB,1024,SSD,1.4 kg,1.40,14 Inch,14.0,IPS,FHD 1920 x 1080,"Brand: ASUS | Tipe: ExpertBook BG1409CVA | Color: Black | Operating System: Windows 11 Home | Processor: Intel Core i7-1355U, 10 Cores, up to 5.0 GHz | Graphics: Intel Iris Xe Graphics | RAM: 16 GB DDR5 (Upgradeable) | Storage: 1 TB SSD NVMe PCIe 4.0 | Main Display Size: 14 Inch | Main Display Type: IPS-Level LCD | Display Resolution: FHD 1920 x 1080, 300 nits, 45% NTSC | Camera: HD Webcam 720p with Privacy Shutter | Audio: Dual stereo speakers with ICEpower, SonicMaster | Battery: 50 Wh | Connectivity: Wi-Fi 6E, Bluetooth 5.3 | Ports: 2x USB-C 2x USB-A 1x HDMI 1x Headphone / microphone combo jack 1x RJ-45 Ethernet | Dimension: 32.45 x 21.44 x 1.97 cm | Weight: 1.4 kg | Warranty: Official ASUS Warranty",https://www.agres.id/products/asus-expertbook-bg1409cva-i7-1355u-16gb-1tb-ssd-140-fhd-w11-3y-tkdn-s67110w,PRODUK HABIS,"gaming berat, editing video, render 3d, gaming ringan, esports, ringan, tipis, mudah dibawa, travel, menengah, multitasking, lancar, kinerja cepat, boot cepat, loading cepat",cpu intel performa tinggi grafis ringan multitasking lancar penyimpanan sangat besar ringan layar sedang layar bagus resolusi standar cocok kerja mudah dibawa cocok office,asus expertbook bg1409cva i7 intel core 1355u iris xe graphics grafis terintegrasi ram 16gb ssd 1tb layar 14.0 inch cpu performa tinggi ringan multitasking lancar penyimpanan sangat besar sedang bagus resolusi standar cocok kerja mudah dibawa office nugas skripsi kuliah sekolah pelajar mahasiswa browsing internet zoom meeting nonton film youtube word excel presentasi ppt kantor buka banyak tab aplikasi anti lelet coding programming programmer software analis data sering bepergian traveling mobilitas enteng tipis ke kampus nongkrong cafe gaming berat editing video render 3d esports travel cepat
ASUS GAMING V16 V3607VM CORE I7 240H RTX5060 8GB/ 16GB 512GB W11+OHS+M365B 16.WUXGA 144HZ BLK -I7N56B6T-HM,ASUS GAMING V16 V3607VM,ASUS,"20,449,000.00",20449000,Windows 11,NVIDIA GeForce RTX 5060,NVIDIA,Intel Core 7 240H,Intel,16 GB,16,DDR5,512 GB,512,SSD,1.95 kg,1.95,16 Inch,16.0,LED,WUXGA 1920 x 1200,"Brand: ASUS | Tipe: GAMING V16 V3607VM | Color: Black | Operating System: Windows 11 Home SL + Microsoft Office Home Student + Microsoft 365 Basic | Processor: Intel Core 7 240H (10 Cores 16 Threads up to 5.2GHz) | Graphics: NVIDIA GeForce RTX 5060 Laptop GPU 8GB GDDR7 plus Intel Graphics | RAM: 16 GB DDR5-5600 SO-DIMM | Storage: 512 GB SSD M.2 PCIe 4.0 NVMe | Main Display Size: 16 Inch | Main Display Type: LED Anti-Glare 144Hz | Display Resolution: WUXGA 1920 x 1200, 16:10, 300 nits | Camera: 1080p FHD with Privacy Shutter | Audio: SonicMaster Stereo Speaker | Battery: 63 Wh Charger: 150 W AC Adapter | Connectivity: Wi-Fi 6, Bluetooth 5.3 | Ports: 2x USB 3.2 Gen 1 Type-A 1x USB 3.2 Gen 1 Type-C support display and power delivery 1x HDMI 2.1 FRL 1x Audio Jack 1x Power Port | Dimension: | Weight: 1.95 kg | Warranty: 2 Years Official ASUS Indonesia Warranty",https://www.agres.id/products/asus-gaming-v16-v3607vm-core-i7-240h-rtx5060-8gb-16gb-512gb-w11ohsm365-16wuxga-144hz-blk-i7n56b6t-hm,https://res.cloudinary.com/dbuug9eey/image/upload/v1765798344/products/svjxhintgbnjgznlfxtt.jpg,"gaming berat, editing video, render 3d, layar besar, nyaman nonton, multimedia, sultan, premium, layar mulus, gaming cepat, multitasking, lancar, kinerja cepat, boot cepat, loading cepat, office, kuliah, presentasi",cpu intel performa dasar gaming berat multitasking lancar penyimpanan besar sedang layar besar resolusi standar cocok gaming cocok kerja,asus gaming v16 v3607vm intel core 7 240h nvidia geforce rtx 5060 ram 16gb ssd 512gb layar 16.0 inch cpu performa dasar berat multitasking lancar penyimpanan besar sedang resolusi standar cocok kerja nugas skripsi kuliah sekolah pelajar mahasiswa browsing internet zoom meeting nonton film youtube word excel presentasi ppt kantor buka banyak tab aplikasi anti lelet coding programming programmer software analis data gamer rata kanan gta cyberpunk render 3d autocad blender sketchup video editor profesional premiere pro after effects editing nyaman multimedia sultan premium mulus cepat office
ASUS PROART P16 OLED TOUCH H7606WM RYZEN AI 9 370 RTX5060 8GB/ 32GB 1TB W11+OHS+M365B 16.0 2.8K BLACK -OLEDS9312TM,ASUS PROART P16 OLED,ASUS,"45,299,000.00",45299000,Windows 11,NVIDIA GeForce RTX 5060,NVIDIA,AMD Ryzen AI 9 HX 370,AMD,32 GB,32,LPDDR5X,1 TB,1024,SSD,1.85 kg,1.85,16 Inch,16.0,OLED,2.8K 2880 x 1800,"Brand: ASUS | Tipe: ProArt P16 OLED Touch H7606WM | Color: Black | Operating System: Windows 11 Home + Microsoft Office Home & Student + Microsoft 365 Basic | Processor: AMD Ryzen AI 9 HX 370, 12 Cores, up to 5.1 GHz | Graphics: NVIDIA GeForce RTX 5060 Laptop GPU 8GB GDDR7 | RAM: 32 GB LPDDR5X (On Board) | Storage: 1 TB SSD NVMe PCIe 4.0 | Main Display Size: 16 Inch | Main Display Type: OLED Touchscreen | Display Resolution: 2.8K 2880 x 1800, 120 Hz, 100% DCI-P3 | Camera: FHD Camera with IR Windows Hello | Audio: Built-in speaker with Smart Amp Technology | Battery: 90 Wh Charger: DC-in Power Adapter | Connectivity: Wi-Fi 7, Bluetooth 5.4 | Ports: 1x USB-A 2x USB-C 1x HDMI 2.1 1x Headphone / microphone combo jack 1x microSD card reader",https://www.agres.id/products/asus-proart-p16-oled-touch-h7606wm-ryzen-ai-9-370-rtx5060-8gb-32gb-1tb-w11ohsm365b-160-2.8K-black-oleds9312tm,https://res.cloudinary.com/dbuug9eey/image/upload/v1775896986/products/l3gv9bqaf8isizfcdenk.jpg,"gaming berat, editing video, render 3d, layar besar, nyaman nonton, multimedia, sultan, premium, layar mulus, gaming cepat, multitasking, lancar, kinerja cepat, boot cepat, loading cepat, office, kuliah, presentasi",cpu amd performa sangat tinggi ai ready gaming berat multitasking ekstrem penyimpanan sangat besar sedang layar besar layar oled resolusi tinggi cocok gaming cocok multimedia,asus proart p16 oled amd ryzen ai 9 hx 370 nvidia geforce rtx 5060 ram 32gb ssd 1tb layar 16.0 inch cpu performa sangat tinggi ready gaming berat multitasking ekstrem penyimpanan besar sedang resolusi cocok multimedia kantor buka banyak tab aplikasi anti lelet coding programming programmer software analis data gamer rata kanan gta cyberpunk render 3d autocad blender sketchup video editor profesional premiere pro after effects nonton netflix kualitas bioskop warna akurat manjakan mata desainer tajam editing nyaman sultan premium mulus cepat lancar office kuliah presentasi
ASUS ROG FLOW Z13 GZ302EA TOUCH RYZEN AI MAX+ 395 32GB 1TB W11+OHS 13.4 WQXGA 180HZ PEN 2IN1 BLK -RZA86N6G-HM,ASUS ROG FLOW Z13,ASUS,"36,999,000.00",36999000,Windows 11,AMD Radeon 8060S Graphics,AMD,AMD Ryzen AI MAX+ 395,AMD,32 GB,32,LPDDR5X,1 TB,1024,SSD,1.55 kg,1.55,"13,4 Inch",13.4,IPS,WQXGA 2560 x 1600,"Brand: ASUS | Tipe: ROG Series | Color: Black | Operating System: Windows 11 Home + Microsoft Office Home & Student | Processor: AMD Ryzen AI MAX+ 395, 16 Cores 32 Threads, up to 5.1 GHz with AMD XDNA NPU up to 50 TOPS | Graphics: AMD Radeon 8060S Graphics | RAM: 32 GB LPDDR5X 8000 Onboard Quad Channel | Storage: 1 TB SSD M.2 PCIe 4.0 NVMe | Main Display Size: 13.4 Inch | Main Display Type: IPS Level Glossy, ROG Nebula Display, Touchscreen | Display Resolution: WQXGA 2560 x 1600, 16:10, 180 Hz, 100% DCI-P3, Pantone Validated | Camera: 13 MP Camera + 5 MP IR Camera | Audio: Dolby Atmos Hi-Res Smart Amplifier | Battery: 70 Wh Charger: 200 W AC Adapter + USB-C 100 W | Connectivity: Wi-Fi 7, Bluetooth 5.4 | Ports: 1x USB 3.2 Gen 2 Type-A 2x USB4 Type-C with DisplayPort and Power Delivery 1x HDMI 2.1 FRL 1x Audio Combo Jack 1x microSD Card Reader UHS-II | Dimension: | Weight: | Warranty: Official ASUS Warranty 2 Years",https://www.agres.id/products/asus-rog-flow-z13-gz302ea-touch-ryzen-ai-max-395-32gb-1tb-w11ohs-134-25k-180hz-pen-2in1-blk--rza86n6g-hm,https://res.cloudinary.com/dbuug9eey/image/upload/v1765626076/products/scfgupwvihbob8d9vypz.jpg,"ringan, tipis, mudah dibawa, travel, sultan, premium, layar mulus, gaming cepat, multitasking, lancar, kinerja cepat, boot cepat, loading cepat, office, kuliah, presentasi, bisa menggambar, desain digital, layar sentuh, mode tablet",cpu amd performa dasar ai ready grafis menengah multitasking ekstrem penyimpanan sangat besar sedang layar compact layar bagus resolusi tinggi cocok multimedia,asus rog flow z13 amd ryzen ai max 395 radeon 8060s graphics ram 32gb ssd 1tb layar 13.4 inch cpu performa dasar ready grafis menengah multitasking ekstrem penyimpanan sangat besar sedang compact bagus resolusi tinggi cocok multimedia nugas skripsi kuliah sekolah pelajar mahasiswa browsing internet zoom meeting nonton film youtube word excel presentasi ppt kantor buka banyak tab aplikasi anti lelet coding programming programmer software analis data main game ringan valorant dota genshin impact esports edit video desain canva photoshop corel illustrator konten kreator netflix kualitas bioskop warna akurat manjakan mata desainer tajam tipis mudah dibawa travel sultan premium mulus gaming cepat lancar office bisa menggambar digital sentuh mode tablet
ASUS ROG STRIX G16 G614FR RYZEN 9 9955HX3D RTX5070TI 12GB/ 32GB 1TB W11+OHS+M365B 16.0WQXGA 240HZ 100DCIP3 (BOX MOU) GRY -R9NT7C6G-HM,ASUS ROG STRIX G16,ASUS,"43,799,000.00",43799000,Windows 11,NVIDIA GeForce RTX 5070 Ti,NVIDIA,AMD Ryzen 9 9955HX3D,AMD,32 GB,32,DDR5,1 TB,1024,SSD,2.5 kg,2.50,16 Inch,16.0,IPS,WQXGA 2560 x 1600,"Brand: ASUS ROG | Tipe: ROG Gaming Laptop | Color: Black | Operating System: Windows 11 Home + Microsoft Office Home and Student + Microsoft 365 Basic | Processor: AMD Ryzen 9 9955HX3D, 16 Cores, 32 Threads, up to 5.4 GHz | Graphics: NVIDIA GeForce RTX 5070 Ti Laptop GPU 12 GB GDDR7 | RAM: 32 GB DDR5 5600 MHz (Up to 64 GB, 2x SO-DIMM) | Storage: 1 TB PCIe 4.0 NVMe™ M.2 SSD | Main Display Size: 16 Inch | Main Display Type: IPS-level, Anti-glare, ROG Nebula Display | Display Resolution: WQXGA 2560 x 1600, 240 Hz, 100 Percent DCI-P3 | Camera: FHD 1080P Webcam | Audio: Dual speakers with Dolby Atmos, Hi-Res Audio, Smart Amplifier | Battery: 90 Wh | Connectivity: Wi-Fi 6E, Bluetooth 5.3 | Ports: 2x USB-A 3.2 Gen 2 2x USB-C USB4 1x HDMI 2.1 1x Headphone / microphone combo jack 1x Ethernet (RJ-45) | Dimension: | Weight: 2.50 kg | Warranty: Official ASUS Warranty 2 Years",https://www.agres.id/products/asus-rog-strix-g16-g614fr-ryzen-9-9955hx3d-rtx5070ti-12gb-32gb-1tb-w11ohsm365b-160wqxga-240hz-100dcip3-box-mou-gry--r9nt7c6g-hm,https://res.cloudinary.com/dbuug9eey/image/upload/v1765624917/products/rl15m1mp7rsp98rkvkqh.jpg,"gaming berat, editing video, render 3d, layar besar, nyaman nonton, multimedia, sultan, premium, layar mulus, gaming cepat, multitasking, lancar, kinerja cepat, boot cepat, loading cepat, office, kuliah, presentasi",cpu amd performa sangat tinggi gaming berat gaming extreme multitasking ekstrem penyimpanan sangat besar berat layar besar layar bagus resolusi tinggi cocok gaming cocok multimedia,asus rog strix g16 amd ryzen 9 9955hx3d nvidia geforce rtx 5070 ti ram 32gb ssd 1tb layar 16.0 inch cpu performa sangat tinggi gaming berat extreme multitasking ekstrem penyimpanan besar bagus resolusi cocok multimedia kantor buka banyak tab aplikasi anti lelet coding programming programmer software analis data gamer rata kanan gta cyberpunk render 3d autocad blender sketchup video editor profesional premiere pro after effects nonton netflix kualitas bioskop warna akurat manjakan mata desainer tajam editing nyaman sultan premium mulus cepat lancar office kuliah presentasi
ASUS ROG STRIX G16 G614PR RYZEN 9 8940HX RTX5070TI 12GB/ 16GB 1TB W11+OHS+M365B 16.0WUXGA 165HZ GRY -R9NT7C6G-HM,ASUS ROG STRIX G16,ASUS,"40,999,000.00",40999000,Windows 11,NVIDIA GeForce RTX 5070 Ti,NVIDIA,AMD Ryzen 9 8940HX,AMD,16 GB,16,DDR5,1 TB,1024,SSD,2.5 kg,2.50,16 Inch,16.0,IPS,WUXGA 1920 x 1200,Brand: ASUS | Tipe: ROG Strix G16 G614PR | Color: Grey | Operating System: Windows 11 Home + Microsoft Office Home and Student + Microsoft 365 Basic | Processor: AMD Ryzen 9 8940HX 16 Cores 32 Threads up to 5.3 GHz | Graphics: NVIDIA GeForce RTX 5070 Ti Laptop GPU 12 GB GDDR7 up to 140 W | RAM: 16 GB DDR5 5200 MHz Upgradable to 64 GB SO-DIMM | Storage: 1 TB PCIe 4.0 NVMe M.2 SSD | Main Display Size: 16 Inch | Main Display Type: IPS Level Anti Glare | Display Resolution: WUXGA 1920 x 1200 165 Hz 100% sRGB | Camera: FHD 1080P Webcam | Audio: Dolby Atmos Hi Res Audio Smart Amplifier AI Noise Canceling | Battery: 90 Wh Charger: 240 W AC Adapter | Connectivity: Wi-Fi 6E Bluetooth 5.3 | Ports: 2x USB-A 3.2 Gen 2 2x USB-C USB4 support DisplayPort Power Delivery G Sync 1x HDMI 2.1 FRL 1x Ethernet RJ 45 1x Headphone microphone combo jack | Dimension: | Weight: 2.5 kg | Warranty: Official ASUS Warranty 2 Years,https://www.agres.id/products/asus-rog-strix-g16-g614pr-ryzen-9-8940hx-rtx5070ti-12gb-16gb-1tb-w11ohsm365b-160fhd-165hz-gry--r9nt7c6g-hm,https://res.cloudinary.com/dbuug9eey/image/upload/v1765623714/products/x5zbspwkrvkvfuqbwzkc.jpg,"gaming berat, editing video, render 3d, layar besar, nyaman nonton, multimedia, sultan, premium, layar mulus, gaming cepat, multitasking, lancar, kinerja cepat, boot cepat, loading cepat, office, kuliah, presentasi",cpu amd performa sangat tinggi gaming berat gaming extreme multitasking lancar penyimpanan sangat besar berat layar besar layar bagus resolusi standar cocok gaming cocok kerja,asus rog strix g16 amd ryzen 9 8940hx nvidia geforce rtx 5070 ti ram 16gb ssd 1tb layar 16.0 inch cpu performa sangat tinggi gaming berat extreme multitasking lancar penyimpanan besar bagus resolusi standar cocok kerja kantor buka banyak tab aplikasi anti lelet coding programming programmer software analis data gamer rata kanan gta cyberpunk render 3d autocad blender sketchup video editor profesional premiere pro after effects editing nyaman nonton multimedia sultan premium mulus cepat office kuliah presentasi
ASUS ROG STRIX SCAR 16 G635LW ULTRA 9 275HX RTX5080 16GB/ 32GB 2TB W11+OHS 16.0 WQXGA MINILED 240HZ PKRGB(BOX MOU) BLK -I9N58MZT-HM,ASUS ROG STRIX SCAR,ASUS,"79,599,000.00",79599000,Windows 11,NVIDIA GeForce RTX 5080,NVIDIA,Intel Core Ultra 9 275HX,Intel,32 GB,32,DDR5,2 TB,2048,SSD,2.8 kg,2.80,16 Inch,16.0,Mini LED,WQXGA 2560 x 1600,Brand: ASUS | Tipe: ROG STRIX SCAR 16 G635LW | Color: Black | Operating System: Windows 11 Home + Office Home Student | Processor: Intel Core Ultra 9 275HX Up To 5.4 GHz 24 Cores 24 Threads With Intel AI Boost NPU Up To 13 TOPS | Graphics: NVIDIA GeForce RTX 5080 Laptop GPU 16 GB GDDR7 ROG Boost Up To 175 W Dynamic Boost | RAM: 32 GB DDR5-5600 SO-DIMM Dual Channel (Upgradeable Up To 64 GB) | Storage: 2 TB SSD M.2 PCIe 4.0 NVMe Dual M.2 Slots | Main Display Size: 16 Inch | Main Display Type: Mini LED Anti-Glare ROG Nebula HDR Display | Display Resolution: WQXGA 2560 x 1600 100% DCI-P3 | Camera: 1080P FHD IR Camera With Windows Hello | Audio: Dolby Atmos 4 Speaker System With Smart Amplifier Hi-Res Certified | Battery: 90 Wh 4 Cell Li-ion Charger: 380 W AC Adapter + 100 W USB-C Power Delivery | Connectivity: Wi-Fi 7 Bluetooth 5.4 | Ports: 3x USB 3.2 Gen 2 Type-A 2x Thunderbolt 5 DisplayPort Power Delivery G-SYNC 1x HDMI 2.1 FRL 1x 2.5G LAN 1x Audio Jack Keyboard: Backlit Chiclet Keyboard Per-Key RGB With Copilot Key Material: Premium Gaming Chassis | Dimension: | Weight: 2.80 kg | Warranty: 2 Years Official ASUS Warranty,https://www.agres.id/products/asus-rog-strix-scar-16-g635lw-ultra-9-275hx-rtx5080-16gb-32gb-2tb-w11ohs-160-25k-miniled-240hz-pkrgbbox-mou-blk--i9n58mzt-hm,https://res.cloudinary.com/dbuug9eey/image/upload/v1765852052/products/lm2sfawywljg48fwabhi.jpg,"gaming berat, editing video, render 3d, layar besar, nyaman nonton, multimedia, sultan, premium, multitasking, lancar, kinerja cepat, boot cepat, loading cepat, office, kuliah, presentasi",cpu intel performa sangat tinggi gaming berat gaming extreme multitasking ekstrem penyimpanan sangat besar berat layar besar layar premium resolusi tinggi cocok gaming cocok multimedia,asus rog strix scar intel core ultra 9 275hx nvidia geforce rtx 5080 ram 32gb ssd 2tb layar 16.0 inch cpu performa sangat tinggi gaming berat extreme multitasking ekstrem penyimpanan besar premium resolusi cocok multimedia kantor buka banyak tab aplikasi anti lelet coding programming programmer software analis data gamer rata kanan gta cyberpunk render 3d autocad blender sketchup video editor profesional premiere pro after effects nonton netflix kualitas bioskop warna akurat manjakan mata desainer tajam editing nyaman sultan lancar cepat office kuliah presentasi
ASUS ROG ZEPHYRUS G14 OLED GA403UH RYZEN 9 270 RTX5050 8GB/ 32GB 1TB W11+OHS+M365B 14.0 NEBULA WQXGA+ 120HZ GRY -R9N55OL6G-HM,ASUS ROG ZEPHYRUS G14,ASUS,"33,199,000.00",33199000,Windows 11,NVIDIA GeForce RTX 5050,NVIDIA,AMD Ryzen 9 270,AMD,32 GB,32,LPDDR5X,1 TB,1024,SSD,1.5 kg,1.50,14 Inch,14.0,OLED,2.8K 2880 x 1800,Brand: ASUS | Tipe: ROG | Color: Grey | Operating System: Windows 11 Home + Microsoft Office Home & Student + Microsoft 365 Basic | Processor: AMD Ryzen 9 270 Processor 8 Cores 16 Threads up to 5.2 GHz with AMD XDNA™ NPU up to 16 TOPS | Graphics: NVIDIA GeForce RTX 5050 Laptop GPU 8GB GDDR7 up to 2142 MHz 90 W with Dynamic Boost | RAM: 32 GB LPDDR5X 7500 Dual Channel Onboard | Storage: 1 TB PCIe 4.0 NVMe™ M.2 SSD | Main Display Size: 14 Inch | Main Display Type: ROG Nebula Display OLED | Display Resolution: 2.8K 2880 x 1800 16:10 120 Hz G Sync Adaptive Sync 100% DCI P3 Pantone Validated Dolby Vision HDR | Camera: 1080P FHD IR Camera with Windows Hello | Audio: Dolby Atmos Quad Speaker Smart Amplifier Hi Res Audio AI Noise Canceling | Battery: 73 Wh Li ion 4 Cell Charger: 200 W AC Adapter and USB Type C 100 W | Connectivity: Wi Fi 7 802.11be Bluetooth 5.4 | Ports: 2x USB 3.2 Gen 2 Type A 1x USB 3.2 Gen 2 Type C DisplayPort Power Delivery G Sync 1x USB4 Type C DisplayPort Power Delivery 1x HDMI 2.1 FRL 1x Audio Jack 1x microSD Card Reader UHS II Keyboard: Backlit Chiclet Keyboard 1 Zone RGB with Copilot Key | Weight: 1.50 kg | Warranty: Official ASUS Indonesia Warranty 2 Years + 1 Year ADP,https://www.agres.id/products/asus-rog-zephyrus-g14-oled-ga403uh-ryzen-9-270-rtx5050-8gb-32gb-1tb-w11ohsm365b-140-nebula-wqxga-120hz-gry--r9n55ol6g-hm,https://res.cloudinary.com/dbuug9eey/image/upload/v1765765536/products/byegxhf8kx7iikw0esj9.jpg,"gaming berat, editing video, render 3d, sultan, premium, layar mulus, gaming cepat, multitasking, lancar, kinerja cepat, boot cepat, loading cepat, office, kuliah, presentasi",cpu amd performa sangat tinggi gaming berat multitasking ekstrem penyimpanan sangat besar ringan layar sedang layar oled resolusi tinggi cocok gaming mudah dibawa cocok multimedia,asus rog zephyrus g14 amd ryzen 9 270 nvidia geforce rtx 5050 ram 32gb ssd 1tb layar 14.0 inch cpu performa sangat tinggi gaming berat multitasking ekstrem penyimpanan besar ringan sedang oled resolusi cocok mudah dibawa multimedia kantor buka banyak tab aplikasi anti lelet coding programming programmer software analis data gamer rata kanan gta cyberpunk render 3d autocad blender sketchup video editor profesional premiere pro after effects sering bepergian traveling mobilitas enteng tipis ke kampus nongkrong cafe nonton netflix kualitas bioskop warna akurat manjakan mata desainer tajam editing sultan premium mulus cepat lancar office kuliah presentasi
ASUS ROG ZEPHYRUS G16 OLED GA605KH RYZEN AI 7 350 RTX5050 8GB/ 32GB 1TB W11+OHS+M365B 16.0 NEBULA OLED WQXGA WQXGA 240HZ GRY -R7N55OL6G-HM,ASUS ROG ZEPHYRUS G16,ASUS,"34,799,000.00",34799000,Windows 11,NVIDIA GeForce RTX 5050,NVIDIA,AMD Ryzen AI 7 350,AMD,32 GB,32,LPDDR5X,1 TB,1024,SSD,1.85 kg,1.85,16 Inch,16.0,OLED,WQXGA 2560 x 1600,"Brand: ASUS ROG | Tipe: ROG Zephyrus G16 | Color: Eclipse Gray | Operating System: Windows 11 Home + Microsoft Office Home & Student + Microsoft 365 Basic | Processor: AMD Ryzen AI 7 350 Processor, 8 Cores 16 Threads, up to 5.0 GHz | Graphics: NVIDIA GeForce RTX 5050 Laptop GPU | RAM: 32 GB LPDDR5X | Storage: 1 TB PCIe 4.0 NVMe™ M.2 SSD | Main Display Size: 16 Inch | Main Display Type: OLED, Glossy, Pantone Validated | Display Resolution: WQXGA 2560 x 1600 | Camera: 1080P FHD IR Camera with Windows Hello | Audio: Not Specified | Battery: 90 Wh | Connectivity: Wi-Fi 7 Bluetooth 5.4 | Ports: 2x USB-A 1x USB-C 1x Thunderbolt 4 1x HDMI 2.1 1x SD Card Reader | Dimension: 35.4 x 24.6 x 1.49 ~ 1.64 cm | Weight: 1.85 kg | Warranty: Official ASUS Warranty",https://www.agres.id/products/asus-rog-zephyrus-g16-oled-ga605kh-ryzen-ai-7-350-rtx5050-8gb-32gb-1tb-w11ohsm365b-160-nebula-oled-wqxga-25k-240hz-gry-r7n55ol6g-hm,https://res.cloudinary.com/dbuug9eey/image/upload/v1769238466/products/rlgg9rjatb7tqeyg4kh6.jpg,"gaming berat, editing video, render 3d, layar besar, nyaman nonton, multimedia, sultan, premium, multitasking, lancar, kinerja cepat, boot cepat, loading cepat, office, kuliah, presentasi",cpu amd performa dasar ai ready gaming berat multitasking ekstrem penyimpanan sangat besar sedang layar besar layar oled resolusi tinggi cocok gaming cocok multimedia,asus rog zephyrus g16 amd ryzen ai 7 350 nvidia geforce rtx 5050 ram 32gb ssd 1tb layar 16.0 inch cpu performa dasar ready gaming berat multitasking ekstrem penyimpanan sangat besar sedang oled resolusi tinggi cocok multimedia nugas skripsi kuliah sekolah pelajar mahasiswa browsing internet zoom meeting nonton film youtube word excel presentasi ppt kantor buka banyak tab aplikasi anti lelet coding programming programmer software analis data gamer rata kanan gta cyberpunk render 3d autocad blender sketchup video editor profesional premiere pro after effects netflix kualitas bioskop warna akurat manjakan mata desainer tajam editing nyaman sultan premium lancar cepat office
