Nama,Nama_Display,Brand,Harga_Rupiah,Harga_Numeric,Sistem_Operasi,GPU,Tipe_GPU,CPU,Tipe_CPU,RAM,RAM_Numeric,Tipe_RAM,Penyimpanan,Penyimpanan_Numeric,Tipe_Penyimpanan,Berat,Berat_Numeric,Ukuran_Layar,Ukuran_Layar_Numeric,Tipe_Panel_Layar,Resolusi_Layar,Deskripsi,Product_URL,Image_URL,Label,Auto_Tag,Metadata
ASUS ZENBOOK S14 OLED 2.8K TOUCH UX5406SA ULTRA 7 258V 32GB 1TB W11+OHS+M365B 14.0 2.8K 120HZ SLV -OLEDS7312TM,ASUS ZENBOOK S14 OLED,ASUS,"28,499,000.00",28499000,Windows 11,Intel Arc Graphics,Intel,Intel Core Ultra 7 258V,Intel,32 GB,32,LPDDR5X,1 TB,1024,SSD,1.2 kg,1.20,14 Inch,14.0,OLED,2.8K 2880 x 1800,"Brand: ASUS | Tipe: Zenbook S14 UX5406SA | Color: White | Operating System: Windows 11 Home + Microsoft Office Home & Student + Microsoft 365 Basic | Processor: Intel Core Ultra 7 258V, up to 4.8 GHz, 8 Cores, 8 Threads | Graphics: Intel Arc Graphics | RAM: 32 GB LPDDR5X | Storage: 1 TB SSD NVMe PCIe 4.0 | Main Display Size: 14 Inch | Main Display Type: OLED, Touchscreen, 120Hz, 16:10, 400 nits, 100% DCI-P3, HDR | Display Resolution: 2.8K 2880 x 1800 | Camera: FHD IR Webcam (Windows Hello) | Audio: Smart Amp Technology, Built-in Speaker, Built-in Array Microphone | Battery: 72 Wh Charger: 65 W USB Type-C | Connectivity: Wi-Fi 7, Bluetooth 5.4 | Ports: 1x USB 3.2 Gen 2 Type-A 2x Thunderbolt 4 (Display / Power Delivery) 1x HDMI 2.1 1x 3.5 mm Audio Combo Jack | Dimension: 31.03 x 21.47 x 1.19 ~ 1.29 cm | Weight: 1.2 kg | Warranty: Official ASUS Warranty 1 Year",https://www.agres.id/products/asus-zenbook-s14-oled-2.8K-touch-ux5406sa-ultra-7-258v-32gb-1tb-w11ohsm365b-140-2.8K-120hz-slv--oleds7312tm,https://res.cloudinary.com/dbuug9eey/image/upload/v1775025218/products/bst7mghicvolr6wgiiza.jpg,"gaming berat, editing video, render 3d, ringan, tipis, mudah dibawa, travel, sultan, premium, layar mulus, gaming cepat, multitasking, lancar, kinerja cepat, boot cepat, loading cepat, office, kuliah, presentasi",cpu intel performa tinggi grafis modern multitasking ekstrem penyimpanan sangat besar ultra ringan layar sedang layar oled resolusi tinggi mudah dibawa cocok multimedia,asus zenbook s14 oled intel core ultra 7 258v arc graphics grafis terintegrasi ram 32gb ssd 1tb layar 14.0 inch cpu performa tinggi modern multitasking ekstrem penyimpanan sangat besar ringan sedang resolusi mudah dibawa cocok multimedia kantor buka banyak tab aplikasi anti lelet coding programming programmer software analis data main game valorant dota genshin impact esports edit video desain canva photoshop corel illustrator konten kreator sering bepergian traveling mobilitas enteng tipis ke kampus nongkrong cafe nonton netflix kualitas bioskop warna akurat manjakan mata desainer tajam gaming berat editing render 3d travel sultan premium mulus cepat lancar office kuliah presentasi
AXIOO HYPE 5 AMD X6 RYZEN 5 6600H 16GB 512GB W11 14.0FHD IPS BLIT GRY,AXIOO HYPE 5 AMD,Axioo,"9,749,000.00",9749000,Windows 11,AMD Radeon 660M,AMD,AMD Ryzen 5 6600H,AMD,16 GB,16,DDR5,512 GB,512,SSD,1.34 kg,1.34,14 Inch,14.0,IPS,WUXGA 1920 x 1200,"Brand: Axioo | Tipe: HYPE 5 AMD X6 | Color: Grey | Operating System: Windows 11 | Processor: AMD Ryzen 5 6600H, 6 Cores, 12 Threads, 3.3 GHz Base, 4.5 GHz Turbo, 45W | Graphics: AMD Radeon 660M | RAM: 16 GB DDR5 (Upgradeable up to 64 GB, 2x8GB) | Storage: 512 GB M.2 2280 PCIe SSD Gen 3x4 (Upgradeable up to 2TB Gen 4) | Main Display Size: 14 Inch | Main Display Type: IPS Panel | Display Resolution: WUXGA 1920 x 1200 | Camera: 21MP Webcam with Privacy Shutter | Audio: HD Audio, Built-in Microphone | Battery: 58 Wh / 5050 mAh Charger: 100 W PD Charger | Connectivity: Wi-Fi 6 Mediatek MT7921, Bluetooth 5.2 | Ports: 2x USB 3.0 Type-A 1x USB 2.0 1x USB 3.2 Gen 1 Type-C Full Function 1x USB 3.2 Gen 2 Type-C Full Function 1x HDMI 1.4 1x 3.5mm Audio Combo Jack | Dimension: 311.6 x 217.8 x 17.3 mm | Weight: 1.34 kg | Warranty: Official Axioo Warranty 1 Year",https://www.agres.id/products/axioo-hype-5-amd-x6-ryzen-5-6600h-16gb-512gb-w11-140fhd-ips-blit-hdmi-gry,https://res.cloudinary.com/dbuug9eey/image/upload/v1765952829/products/aunqub13frbczanzy01a.jpg,"ringan, tipis, mudah dibawa, travel, murah, terjangkau, multitasking, lancar, kinerja cepat, boot cepat, loading cepat",cpu amd performa menengah grafis menengah multitasking lancar penyimpanan sangat besar ringan layar sedang layar bagus resolusi standar cocok kerja mudah dibawa,axioo hype 5 amd ryzen 6600h radeon 660m ram 16gb ssd 512gb layar 14.0 inch cpu performa menengah grafis multitasking lancar penyimpanan besar ringan sedang bagus resolusi standar cocok kerja mudah dibawa nugas skripsi kuliah sekolah pelajar mahasiswa browsing internet zoom meeting nonton film youtube word excel presentasi ppt kantor buka banyak tab aplikasi anti lelet coding programming programmer software analis data main game valorant dota genshin impact esports edit video desain canva photoshop corel illustrator konten kreator sering bepergian traveling mobilitas tinggi enteng tipis ke kampus nongkrong cafe travel murah cepat
AXIOO HYPE 7 AMD X7 RYZEN 7 5700 8GB 512GB W11 14.0FHD IPS BLIT GRY,AXIOO HYPE 7 AMD,Axioo,"8,149,000.00",8149000,Windows 11,AMD Radeon RX Vega 8,AMD,AMD Ryzen 7-5700U,AMD,8 GB,8,DDR4,512 GB,512,SSD,1.41 kg,1.41,14 Inch,14.0,IPS,FHD 1920 x 1080,"Brand: Axioo | Tipe: HYPE 7 | Color: Grey | Operating System: Windows 11 Home | Processor: AMD Ryzen 7-5700U, 8 Cores, 16 Threads, up to 4.3 GHz | Graphics: AMD Radeon RX Vega 8 | RAM: 8 GB DDR4 (Upgradeable up to 64 GB, 2x SODIMM, up to 3200 MHz) | Storage: 512 GB M.2 NVMe PCIe Gen 3 x4 | Main Display Size: 14 Inch | Main Display Type: IPS LCD, LED Backlight, Anti-glare | Display Resolution: FHD 1920 x 1080, 45% NTSC, 250 nits | Camera: 2 MP Front Camera | Audio: Dual built-in speakers with HD Audio | Battery: 45.6 Wh Charger: 65 W AC Adapter | Connectivity: Wi-Fi 802.11 ac/b/g/n, Bluetooth 5.1 | Ports: 2x USB 3.2 Gen1 Type-A 1x USB 2.0 1x USB Type-C 1x HDMI 1.4 1x 3.5mm Audio Combo Jack 1x DC-in | Dimension: 322 x 206 x 19.4 mm | Weight: 1.41 kg | Warranty: Official Axioo Warranty 1 Year",https://www.agres.id/products/axioo-hype-7-ryzen-7-5700-8gb-512gb-w11pro-140fhd-gry,https://res.cloudinary.com/dbuug9eey/image/upload/v1772532605/products/bivaustcljqozkibkrz6.jpg,"ringan, tipis, mudah dibawa, travel, murah, terjangkau, tugas ringan, office dasar",cpu amd performa tinggi grafis menengah multitasking cukup penyimpanan besar ringan layar sedang layar bagus resolusi standar mudah dibawa,axioo hype 7 amd ryzen 5700u radeon rx vega 8 ram 8gb ssd 512gb layar 14.0 inch cpu performa tinggi grafis menengah multitasking cukup penyimpanan besar ringan sedang bagus resolusi standar mudah dibawa nugas skripsi kuliah sekolah pelajar mahasiswa browsing internet zoom meeting nonton film youtube word excel presentasi ppt kantor buka banyak tab aplikasi anti lelet coding programming programmer software analis data main game valorant dota genshin impact esports edit video desain canva photoshop corel illustrator konten kreator sering bepergian traveling mobilitas enteng tipis ke kampus nongkrong cafe travel murah tugas office dasar
AXIOO HYPE 7 AMD X8-1 RYZEN 7 6800H 16GB 512GB W11 14.0FHD IPS BLIT GRY,AXIOO HYPE 7 AMD,Axioo,"10,049,000.00",10049000,Windows 11,AMD Radeon 680M,AMD,AMD Ryzen 7 6800H,AMD,16 GB,16,DDR5,512 GB,512,SSD,1.46 kg,1.46,14 Inch,14.0,IPS,WUXGA 1920 x 1200,"Brand: AXIOO | Tipe: HYPE 7 | Color: Grey | Operating System: Windows 11 | Processor: AMD Ryzen 7 6800H, 8 Cores, 16 Threads, up to 4.7 GHz | Graphics: AMD Radeon 680M | RAM: 16 GB DDR5 (2x 8 GB, Up to 64 GB) | Storage: 512 GB M.2 2280 PCIe SSD Gen 3x4 (Up to 2 TB PCIe Gen 4) | Main Display Size: 14 Inch | Main Display Type: IPS | Display Resolution: WUXGA 1920 x 1200, Aspect Ratio 16:10 | Ports: 2x USB 3.0 Type A 1x USB 2.0 1x USB 3.2 Gen1 Type C (Data, Power, Video) 1x USB 3.2 Gen2 Type C (Data, Power, Video) 1x HDMI 1.4 1x 3.5 mm Audio Combo Jack | Warranty: Official AXIOO Warranty 1 Year",https://www.agres.id/products/axioo-hype-7-amd-x8-1-ryzen-7-6800h-16gb-512gb-w11-140fhd-ips-blit-hdmi-gry,https://res.cloudinary.com/dbuug9eey/image/upload/v1769394050/products/eq915j5jdau4dc9c2xta.jpg,"gaming berat, editing video, render 3d, menengah, multitasking, lancar, kinerja cepat, boot cepat, loading cepat",cpu amd performa tinggi grafis menengah multitasking lancar penyimpanan sangat besar ringan layar sedang layar bagus resolusi standar cocok kerja mudah dibawa,axioo hype 7 amd ryzen 6800h radeon 680m ram 16gb ssd 512gb layar 14.0 inch cpu performa tinggi grafis menengah multitasking lancar penyimpanan besar ringan sedang bagus resolusi standar cocok kerja mudah dibawa kantor buka banyak tab aplikasi anti lelet coding programming programmer software analis data main game valorant dota genshin impact esports edit video desain canva photoshop corel illustrator konten kreator sering bepergian traveling mobilitas enteng tipis ke kampus nongkrong cafe gaming berat editing render 3d cepat
AXIOO HYPE-R 5 TOUCH I5 1235 24GB 512GB W11 14.0FHD IPS GRY (1KG),AXIOO HYPE-R 5 TOUCH,Axioo,"10,799,000.00",10799000,Windows 11,Intel Iris Xe Graphics,Intel,Intel Core i5-1235U,Intel,24 GB,24,LPDDR5,512 GB,512,SSD,1 kg,1.00,14 Inch,14.0,IPS,WUXGA 1920 x 1200,"Brand: Axioo | Tipe: HYPE-R 5 TOUCH | Color: Grey | Operating System: Windows 11 | Processor: Intel Core i5-1235U, 10 Cores (2P + 8E) / 12 Threads, up to 4.4 GHz | Graphics: Intel Iris Xe Graphics (eligible) | RAM: 24 GB LPDDR5 (Onboard) | Storage: 512 GB SSD M.2 2280 NVMe (support up to Gen 4x4) | Main Display Size: 14 Inch | Main Display Type: IPS, Touchscreen (10-point multi-touch), 16:10 | Display Resolution: WUXGA 1920 x 1200 | Camera: 720p HD Webcam | Audio: 2x Speaker 2W, Integrated Microphone | Battery: 60.01 Wh Li-Polymer Charger: 65W PD 3.0 Adapter | Connectivity: Wi-Fi 6, Bluetooth 5.2 | Ports: 1x USB 3.2 Gen1 Type-C (Data, Display, Charge) 1x USB 3.2 Gen1 Type-C (Charging Only) 1x USB 3.2 Gen1 Type-A 1x USB 2.0 Type-C 1x HDMI 1.4 1x 3.5mm Audio Combo Jack | Dimension: 311.6 x 217.8 x 15.95 mm | Weight: 1 Kg | Warranty: Garansi Resmi Axioo 1 Tahun",https://www.agres.id/products/axioo-hype-r-5-touch-i5-1235-24gb-512gb-w11-140fhd-ips-gry-1kg,https://res.cloudinary.com/dbuug9eey/image/upload/v1775797740/products/yvgqaeikwt2frp40bl3k.jpg,"ringan, tipis, mudah dibawa, travel, menengah, multitasking, lancar, kinerja cepat, boot cepat, loading cepat",cpu intel performa menengah grafis ringan multitasking lancar penyimpanan besar ultra ringan layar sedang layar bagus resolusi standar cocok kerja mudah dibawa cocok office,axioo hype r 5 touch intel core i5 1235u iris xe graphics grafis terintegrasi ram 24gb ssd 512gb layar 14.0 inch cpu performa menengah ringan multitasking lancar penyimpanan besar ultra sedang bagus resolusi standar cocok kerja mudah dibawa office nugas skripsi kuliah sekolah pelajar mahasiswa browsing internet zoom meeting nonton film youtube word excel presentasi ppt kantor buka banyak tab aplikasi anti lelet coding programming programmer software analis data sering bepergian traveling mobilitas tinggi enteng tipis ke kampus nongkrong cafe travel cepat
AXIOO PONGO 725 V2 I7 13620H RTX2050 4GB/ 16GB 512GB W11 15.6FHD 144HZ IPS 3Y BLK,AXIOO PONGO 725 V2,Axioo,"13,849,000.00",13849000,Windows 11,NVIDIA GeForce RTX 2050,NVIDIA,Intel Core i7 13620H,Intel,16 GB,16,DDR4,512 GB,512,SSD,2.15 kg,2.15,"15,6 Inch",15.6,FHD,FHD 1920 x 1080,"Brand: AXIOO | Tipe: PONGO 725 V2 | Color: Black | Operating System: Windows 11 | Processor: Intel Core i7 13620H, 10 Cores, 16 Threads, Up to 4.7 GHz | Graphics: Intel Graphics + NVIDIA GeForce RTX 2050 Laptop GPU 4 GB GDDR6 | RAM: 16 GB DDR4 | Storage: 512 GB M.2 2280 PCIe Gen 3 SSD | Main Display Size: 15.6 Inch | Main Display Type: FHD | Display Resolution: 1920 x 1080 Aspect Ratio: 16:9 | Camera: - | Audio: Built-in Speaker, Built-in Microphone | Connectivity: Wi-Fi, Bluetooth | Ports: 1x USB 2.0 Type-A 1x USB 3.2 Gen 1 Type-A 2x USB 3.2 Gen 2 Type-C 1x Mini DisplayPort 1.4 1x HDMI 1.4b 1x 2-in-1 Audio Jack 1x Microphone Jack 1x RJ45 Gigabit LAN 1x DC In 1x MicroSD Card Reader | Dimension: – | Weight: – | Warranty: 1 Years Official Axioo Warranty",https://www.agres.id/products/axioo-pongo-725-v2-i7-13620h-rtx2050-4gb-16gb-512gb-w11-156fhd-144hz-ips-3y-blk-1,https://res.cloudinary.com/dbuug9eey/image/upload/v1773288068/products/hsk8cauwgvip4asswpff.jpg,"gaming berat, editing video, render 3d, layar besar, nyaman nonton, multimedia, menengah, multitasking, lancar, kinerja cepat, boot cepat, loading cepat",cpu intel performa tinggi gaming berat multitasking lancar penyimpanan besar berat layar sedang resolusi standar cocok gaming cocok kerja,axioo pongo 725 v2 intel core i7 13620h nvidia geforce rtx 2050 ram 16gb ssd 512gb layar 15.6 inch cpu performa tinggi gaming berat multitasking lancar penyimpanan besar sedang resolusi standar cocok kerja kantor buka banyak tab aplikasi anti lelet coding programming programmer software analis data gamer rata kanan gta cyberpunk render 3d autocad blender sketchup video editor profesional premiere pro after effects editing nyaman nonton multimedia cepat
AXIOO PONGO 775 I7 13620H RTX5070 8GB/ 16GB 512GB W11 16.0QHD 180HZ 100SRGB RGB 3Y BLK,AXIOO PONGO 775 I7,Axioo,"24,699,000.00",24699000,Windows 11,NVIDIA GeForce RTX 5070,NVIDIA,Intel Core i7-13620H,Intel,16 GB,16,DDR5,512 GB,512,SSD,2.35 kg,2.35,16 Inch,16.0,IPS,WQXGA 2560 x 1600,"Brand: AXIOO | Tipe: PONGO 775 | Color: Black | Operating System: Windows 11 | Processor: Intel Core i7-13620H, 10 Cores, 16 Threads, up to 4.9 GHz | Graphics: NVIDIA GeForce RTX 5070 Laptop GPU 8GB GDDR7 up to 115W + Intel Graphics | RAM: 16 GB DDR5 5600 MHz SODIMM | Storage: 512 GB SSD M.2 PCIe 4.0 NVMe | Main Display Size: 16 Inch | Main Display Type: IPS | Display Resolution: WQXGA 2560 x 1600 Aspect Ratio: 16:10 Refresh Rate: 180 Hz | Camera: – | Audio: Sound Blaster Studio Plus with Realtek HD Audio | Battery: – Charger: DC-In Adapter | Connectivity: Wi-Fi 6 (Intel AX211), Bluetooth 5.3 | Ports: 1x USB 2.0 1x USB 3.2 Gen 2 Type-A 1x USB 3.2 Gen 1 Type-A 1x USB 3.2 Gen 2 Type-C (DisplayPort) 1x Mini DisplayPort 1.4 1x HDMI 1.4b 1x Audio Jack 1x Ethernet RJ-45 1x DC-In | Dimension: – | Weight: 2.35 kg | Warranty: Official Axioo Warranty 3 Years",https://www.agres.id/products/axioo-pongo-775-i7-13620h-rtx5070-8gb-16gb-512gb-w11-160qhd-180hz-100srgb-rgb-3y-blk,https://res.cloudinary.com/dbuug9eey/image/upload/v1765791694/products/yqq8s3yb1wxi9ksacp9v.jpg,"gaming berat, editing video, render 3d, layar besar, nyaman nonton, multimedia, sultan, premium, layar mulus, gaming cepat, multitasking, lancar, kinerja cepat, boot cepat, loading cepat",cpu intel performa tinggi gaming berat gaming extreme multitasking lancar penyimpanan besar berat layar besar layar bagus resolusi tinggi cocok gaming cocok kerja cocok multimedia,axioo pongo 775 i7 intel core 13620h nvidia geforce rtx 5070 ram 16gb ssd 512gb layar 16.0 inch cpu performa tinggi gaming berat extreme multitasking lancar penyimpanan besar bagus resolusi cocok kerja multimedia kantor buka banyak tab aplikasi anti lelet coding programming programmer software analis data gamer rata kanan gta cyberpunk render 3d autocad blender sketchup video editor profesional premiere pro after effects nonton netflix kualitas bioskop warna akurat manjakan mata desainer tajam editing nyaman sultan premium mulus cepat
DELL PRO 14 ESSENTIAL PV14255 RYZEN 5 220 8GB 512GB 14.0WUXGA W11PRO 2/2/2 BLK,DELL PRO 14 ESSENTIAL,Dell,"9,999,000.00",9999000,Windows 11,AMD Radeon Graphics,AMD,AMD Ryzen 5 220,AMD,8 GB,8,DDR5,512 GB,512,SSD,1.54 kg,1.54,14 Inch,14.0,IPS,WUXGA 1920 x 1200,"Brand: Dell | Tipe: Pro Essential PV14255 | Color: Carbon Black | Operating System: Windows 11 Pro | Processor: AMD Ryzen 5 220, 6 Cores, up to 4.9 GHz | Graphics: AMD Radeon Graphics | RAM: 8 GB DDR5 5600 MHz (Upgradeable) | Storage: 512 GB SSD NVMe PCIe | Main Display Size: 14 Inch | Main Display Type: IPS, Anti-Glare | Display Resolution: WUXGA 1920 x 1200 | Camera: HD 720p Webcam | Audio: Stereo speakers with Dolby Atmos | Battery: 41 Wh | Connectivity: Wi-Fi 6, Bluetooth | Ports: 2x USB-A 1x USB-C 1x HDMI 1.4 1x Headphone / microphone combo jack 1x SD card reader | Dimension: 314 x 226.15 x 19.9 mm | Weight: 1.54 kg | Warranty: Official Dell Warranty 1 Year Onsite Service",https://www.agres.id/products/dell-pro-14-essential-pv14255-ryzen-5-220-8gb-512gb-140-wuxga-w11pro-2y-black,https://res.cloudinary.com/dbuug9eey/image/upload/v1771644141/products/xw0qa3j1l0ti0eyj52bc.jpg,"murah, terjangkau, tugas ringan, office dasar, boot cepat, loading cepat",cpu amd performa menengah grafis menengah multitasking cukup penyimpanan besar sedang layar sedang layar bagus resolusi standar,dell pro 14 essential amd ryzen 5 220 radeon graphics ram 8gb ssd 512gb layar 14.0 inch cpu performa menengah grafis multitasking cukup penyimpanan besar sedang bagus resolusi standar nugas skripsi kuliah sekolah pelajar mahasiswa browsing internet zoom meeting nonton film youtube word excel presentasi ppt main game ringan valorant dota genshin impact esports edit video desain canva photoshop corel illustrator konten kreator murah tugas office dasar cepat
HP 14 I3 1315 8GB 512GB W11+OHS+M365B 14.0FHD BLIT COPILOT 2Y GLD -EP0260TU,HP 14 I3 1315,HP,"8,299,000.00",8299000,Windows 11,Intel UHD Graphics,Intel,Intel Core i3-1315U,Intel,8 GB,8,DDR4,512 GB,512,SSD,1.41 kg,1.41,14 Inch,14.0,IPS,FHD 1920 x 1080,"Brand: HP | Tipe: HP 14 | Color: Warm Gold | Operating System: Windows 11 Home SL + Microsoft Office Home + Microsoft 365 Basic | Processor: Intel Core i3-1315U, 6 Cores / 8 Threads, up to 4.5 GHz | Graphics: Intel UHD Graphics | RAM: 8 GB DDR4 3200 MHz (1x8 GB) | Storage: 512 GB SSD PCIe NVMe M.2 | Main Display Size: 14 Inch | Main Display Type: Anti-Glare | Display Resolution: FHD 1920 x 1080, 250 nits | Camera: HP True Vision 1080p FHD Camera | Audio: Two built-in stereo speakers | Battery: 41 Wh | Connectivity: Wi-Fi 6, Bluetooth 5.4 | Ports: 2x USB-A 5Gbps 1x USB-C 5Gbps 1x HDMI 1.4b 1x Headphone / microphone combo jack 1x AC Smart Pin | Dimension: | Weight: 1.41 kg | Warranty: Official HP Warranty 2 Years",https://www.agres.id/products/hp-14-i3-1315-8gb-512gb-w11ohsm365b-140fhd-blit-copilot-2y-gld-ep0260tu,https://res.cloudinary.com/dbuug9eey/image/upload/v1765173405/products/jbdhsltgqkpfs2pwtb72.jpg,"ringan, tipis, mudah dibawa, travel, murah, terjangkau, tugas ringan, office dasar, boot cepat, loading cepat, office, kuliah, presentasi",cpu intel performa dasar grafis ringan multitasking cukup penyimpanan besar ringan layar sedang layar bagus resolusi standar mudah dibawa cocok office,hp 14 i3 1315 intel core 1315u uhd graphics grafis terintegrasi ram 8gb ssd 512gb layar 14.0 inch cpu performa dasar ringan multitasking cukup penyimpanan besar sedang bagus resolusi standar mudah dibawa cocok office nugas skripsi kuliah sekolah pelajar mahasiswa browsing internet zoom meeting nonton film youtube word excel presentasi ppt sering bepergian traveling mobilitas tinggi enteng tipis ke kampus nongkrong cafe travel murah tugas cepat
HP ENVY X360 14 OLED RYZEN 7 8840HS 32GB 1TB W11+OHS 14.0 2.8K 120HZ BLIT PEN 2Y+2ADP 2IN1 SLV -FA0888AU,HP ENVY X360 14,HP,"18,999,000.00",18999000,Windows 11,AMD Radeon Graphics,AMD,AMD Ryzen 7 8840HS,AMD,32 GB,32,LPDDR5,1 TB,1024,SSD,1.39 kg,1.39,14 Inch,14.0,OLED,2.8K 2880 x 1800,"Brand: HP | Tipe: Envy x360 | Color: Natural Silver | Operating System: Windows 11 Home + Microsoft Office Home & Student | Processor: AMD Ryzen 7 8840HS, 8 Cores, up to 5.1 GHz | Graphics: AMD Radeon Graphics | RAM: 32 GB LPDDR5-6400 Onboard | Storage: 1 TB SSD NVMe PCIe Gen4 | Main Display Size: 14 Inch | Main Display Type: OLED Multitouch, Edge-to-edge Glass, UWVA, Low Blue Light | Display Resolution: 2.8K 2880 x 1800, 100% DCI-P3, SDR 400 nits, HDR 500 nits | Camera: 5 MP IR Camera | Audio: Poly Studio Dual Speakers, DTS:X Ultra, HP Audio Boost | Battery: 59 Wh | Connectivity: Wi-Fi 7, Bluetooth 5.4 | Ports: 2x USB-A 1x USB-C 1x Thunderbolt 4 USB-C 1x HDMI 2.1 1x Headphone / microphone combo jack | Dimension: | Weight: 1.39 kg | Warranty: Official HP Warranty 2 Years + Accidental Damage Protection",https://www.agres.id/products/hp-envy-x360-14-oled-ryzen-7-8840hs-32gb-1tb-w11ohs-140-28k-120hz-blit-pen-2yadp-2in1-slv--fa0888au,https://res.cloudinary.com/dbuug9eey/image/upload/v1765367615/products/k4cjdpf80dtwrlrhtppr.jpg,"ringan, tipis, mudah dibawa, travel, menengah, multitasking, lancar, kinerja cepat, boot cepat, loading cepat, office, kuliah, presentasi",cpu amd performa tinggi grafis menengah multitasking ekstrem penyimpanan sangat besar ringan layar sedang layar oled resolusi tinggi mudah dibawa cocok multimedia,hp envy x360 14 amd ryzen 7 8840hs radeon graphics ram 32gb ssd 1tb layar 14.0 inch cpu performa tinggi grafis menengah multitasking ekstrem penyimpanan sangat besar ringan sedang oled resolusi mudah dibawa cocok multimedia kantor buka banyak tab aplikasi anti lelet coding programming programmer software analis data main game valorant dota genshin impact esports edit video desain canva photoshop corel illustrator konten kreator sering bepergian traveling mobilitas enteng tipis ke kampus nongkrong cafe nonton netflix kualitas bioskop warna akurat manjakan mata desainer tajam travel lancar cepat office kuliah presentasi
HP HYPERX OMEN 15 I7 14650HX RTX5060 8GB/ 24GB 1TB W11+OHS+M365B 15.3WQXGA 180HZ 100SRGB 4ZRGB 2Y+2ADP BLK -GA0888TX,HP HYPERX OMEN 15,HP,"24,999,000.00",24999000,Windows 11,NVIDIA GeForce RTX 5060,NVIDIA,Intel Core i7-14650HX,Intel,24 GB,24,DDR5,1 TB,1024,SSD,2.21 kg,2.21,"15,3 Inch",15.3,IPS,WQXGA 2560 x 1600,"Brand: HP | Tipe: HyperX OMEN | Color: Shadow Black | Operating System: Windows 11 Home Single Language + Office Home & Student + Microsoft 365 Basic | Processor: Intel Core i7-14650HX (up to 5.2 GHz with Intel Turbo Boost Technology, 30 MB L3 Cache, 16 Cores, 24 Threads) | Graphics: NVIDIA GeForce RTX 5060 Laptop GPU 8 GB GDDR7 | RAM: 24 GB DDR5-5600 (1 x 24 GB, Upgradeable, 2 Slots) | Storage: 1 TB PCIe Gen4 NVMe™ M.2 SSD | Main Display Size: 15.3 Inch | Main Display Type: IPS, Anti-Glare, Micro-Edge, 180 Hz, 3 ms Response Time, 500 nits | Display Resolution: WQXGA 2560 x 1600, 100% sRGB | Camera: 1080p FHD Webcam with HDR Auto Switch and Dual Array Digital Microphones | Audio: Dual Speakers, DTS:X Ultra, HP Audio Boost, HyperX | Battery: 70 Wh 4-Cell Li-ion Polymer Charger: 280 W AC Adapter | Connectivity: Realtek Wi-Fi 6 (2x2), Bluetooth 5.4, Integrated 10/100/1000 GbE LAN | Ports: 2x USB Type-A 10Gbps 1x USB Type-C 10Gbps (Power Delivery 3.1, DisplayPort™ 1.4, HP Sleep and Charge) 1x HDMI 2.1 1x RJ-45 1x Headphone / microphone combo jack 1x AC Smart Pin | Dimension: 34.3 x 25.3 x 2.25 cm (Front) / 34.3 x 25.3 x 2.36 cm (Rear) | Weight: 2.21 kg | Warranty: Official HP Warranty 2 Years",https://www.agres.id/products/hp-omen-15-ga0888tx-i7-14650hx-24gb-1tb-rtx5060-8gb-w11-153wqxga-ips-180hz-blk,https://res.cloudinary.com/dbuug9eey/image/upload/v1771903671/products/gjlt28fffiykoh9cuihd.jpg,"gaming berat, editing video, render 3d, sultan, premium, layar mulus, gaming cepat, multitasking, lancar, kinerja cepat, boot cepat, loading cepat, office, kuliah, presentasi",cpu intel performa tinggi gaming berat multitasking lancar penyimpanan sangat besar berat layar sedang layar bagus resolusi tinggi cocok gaming cocok kerja cocok multimedia,hp hyperx omen 15 intel core i7 14650hx nvidia geforce rtx 5060 ram 24gb ssd 1tb layar 15.3 inch cpu performa tinggi gaming berat multitasking lancar penyimpanan sangat besar sedang bagus resolusi cocok kerja multimedia kantor buka banyak tab aplikasi anti lelet coding programming programmer software analis data gamer rata kanan gta cyberpunk render 3d autocad blender sketchup video editor profesional premiere pro after effects nonton netflix kualitas bioskop warna akurat manjakan mata desainer tajam editing sultan premium mulus cepat office kuliah presentasi
